{
  "schema_version": 1,
  "case_id": "DATA_PIPE.SIGNALS.008",
  "court": "data-pipe",
  "reference_revision": "151.0.7922.105",
  "seed": 0,
  "preconditions": {
    "required_capabilities": ["data_pipe", "signals"],
    "init": {"mode": "default"}
  },
  "operations": [
    {"id": 1, "op": "data_pipe_create", "args": {"element_num_bytes": 1, "capacity_num_bytes": 4}, "expect": {"result": "MOJO_RESULT_OK", "produce": ["p", "c"]}},
    {"id": 2, "op": "query_signals_state", "args": {"handle": "p"}, "expect": {"result": "MOJO_RESULT_OK"}},
    {"id": 3, "op": "write_data", "args": {"handle": "p", "elements_hex": "01020304", "flags": []}, "expect": {"result": "MOJO_RESULT_OK"}},
    {"id": 4, "op": "query_signals_state", "args": {"handle": "p"}, "expect": {"result": "MOJO_RESULT_OK"}},
    {"id": 5, "op": "query_signals_state", "args": {"handle": "c"}, "expect": {"result": "MOJO_RESULT_OK"}},
    {"id": 6, "op": "read_data", "args": {"handle": "c", "num_bytes": 2, "flags": []}, "expect": {"result": "MOJO_RESULT_OK"}},
    {"id": 7, "op": "query_signals_state", "args": {"handle": "p"}, "expect": {"result": "MOJO_RESULT_OK"}},
    {"id": 8, "op": "write_data", "args": {"handle": "p", "elements_hex": "0506", "flags": []}, "expect": {"result": "MOJO_RESULT_OK"}},
    {"id": 9, "op": "query_signals_state", "args": {"handle": "c"}, "expect": {"result": "MOJO_RESULT_OK"}},
    {"id": 10, "op": "read_data", "args": {"handle": "c", "num_bytes": 4, "flags": []}, "expect": {"result": "MOJO_RESULT_OK"}},
    {"id": 11, "op": "query_signals_state", "args": {"handle": "c"}, "expect": {"result": "MOJO_RESULT_OK"}},
    {"id": 12, "op": "close", "args": {"handle": "p"}, "expect": {"result": "MOJO_RESULT_OK"}},
    {"id": 13, "op": "close", "args": {"handle": "c"}, "expect": {"result": "MOJO_RESULT_OK"}}
  ],
  "expected_contract": {
    "note": "WRITABLE drops when the ring is full and returns after consumption; NEW_DATA_READABLE latches per arrival and clears after each read; READABLE tracks buffered data"
  },
  "normalizers": []
}
